[I 2024-05-07 15:25:22,594] A new study created in memory with name: no-name-ef9898eb-03d2-4491-a92b-702f6f4ee1f4
[I 2024-05-07 15:26:10,139] Trial 0 finished with value: 0.5556660175323487 and parameters: {'num_lstm_layers': 2, 'lstm_units_1': 107, 'dropout_1': 0.435911668874414, 'optimizer': 'RMSprop', 'lstm_units_2': 25, 'dropout_2': 0.2519057548554737}. Best is trial 0 with value: 0.5556660175323487.
[I 2024-05-07 15:26:57,259] Trial 1 finished with value: 0.5682999134063721 and parameters: {'num_lstm_layers': 2, 'lstm_units_1': 35, 'dropout_1': 0.23825439080446498, 'optimizer': 'RMSprop', 'lstm_units_2': 35, 'dropout_2': 0.07452214222829118}. Best is trial 1 with value: 0.5682999134063721.
[I 2024-05-07 15:27:28,241] Trial 2 finished with value: 0.593858826160431 and parameters: {'num_lstm_layers': 1, 'lstm_units_1': 94, 'dropout_1': 0.34076936399660396, 'optimizer': 'RMSprop'}. Best is trial 2 with value: 0.593858826160431.
[I 2024-05-07 15:28:25,640] Trial 3 finished with value: 0.6108230352401733 and parameters: {'num_lstm_layers': 3, 'lstm_units_1': 97, 'dropout_1': 0.15501494271462735, 'optimizer': 'Adam', 'lstm_units_2': 22, 'dropout_2': 0.4130837771548928, 'lstm_units_3': 125, 'dropout_3': 0.4737179934394494}. Best is trial 3 with value: 0.6108230352401733.
[I 2024-05-07 15:29:22,786] Trial 4 finished with value: 0.546591603755951 and parameters: {'num_lstm_layers': 3, 'lstm_units_1': 24, 'dropout_1': 0.20469863356182122, 'optimizer': 'Adam', 'lstm_units_2': 26, 'dropout_2': 0.3454454204705179, 'lstm_units_3': 128, 'dropout_3': 0.44803853398473537}. Best is trial 3 with value: 0.6108230352401733.
[I 2024-05-07 15:30:19,358] Trial 5 finished with value: 0.5326741695404053 and parameters: {'num_lstm_layers': 3, 'lstm_units_1': 33, 'dropout_1': 0.4942380234978032, 'optimizer': 'Adam', 'lstm_units_2': 52, 'dropout_2': 0.42448092495838174, 'lstm_units_3': 16, 'dropout_3': 0.308271004192417}. Best is trial 3 with value: 0.6108230352401733.
[I 2024-05-07 15:30:47,234] Trial 6 finished with value: 0.5684061169624328 and parameters: {'num_lstm_layers': 1, 'lstm_units_1': 87, 'dropout_1': 0.34260618488969596, 'optimizer': 'SGD'}. Best is trial 3 with value: 0.6108230352401733.
[I 2024-05-07 15:31:51,137] Trial 7 finished with value: 0.5230083346366883 and parameters: {'num_lstm_layers': 3, 'lstm_units_1': 34, 'dropout_1': 0.4732015658748638, 'optimizer': 'RMSprop', 'lstm_units_2': 50, 'dropout_2': 0.06349309120540914, 'lstm_units_3': 34, 'dropout_3': 0.18027759665559756}. Best is trial 3 with value: 0.6108230352401733.
[I 2024-05-07 15:32:55,128] Trial 8 finished with value: 0.5683951258659363 and parameters: {'num_lstm_layers': 3, 'lstm_units_1': 85, 'dropout_1': 0.39448567167875737, 'optimizer': 'RMSprop', 'lstm_units_2': 100, 'dropout_2': 0.4395561249518172, 'lstm_units_3': 46, 'dropout_3': 0.4764658561449898}. Best is trial 3 with value: 0.6108230352401733.
[I 2024-05-07 15:33:26,587] Trial 9 finished with value: 0.5483566761016846 and parameters: {'num_lstm_layers': 1, 'lstm_units_1': 28, 'dropout_1': 0.418025135456059, 'optimizer': 'RMSprop'}. Best is trial 3 with value: 0.6108230352401733.
[I 2024-05-07 15:34:09,534] Trial 10 finished with value: 0.6150160193443298 and parameters: {'num_lstm_layers': 2, 'lstm_units_1': 127, 'dropout_1': 0.049567097993495124, 'optimizer': 'Adam', 'lstm_units_2': 88, 'dropout_2': 0.26116180350128393}. Best is trial 10 with value: 0.6150160193443298.
[I 2024-05-07 15:34:57,650] Trial 11 finished with value: 0.5750251770019531 and parameters: {'num_lstm_layers': 2, 'lstm_units_1': 127, 'dropout_1': 0.0323049564834596, 'optimizer': 'Adam', 'lstm_units_2': 92, 'dropout_2': 0.2357935269087917}. Best is trial 10 with value: 0.6150160193443298.
[I 2024-05-07 15:35:41,863] Trial 12 finished with value: 0.5962244987487793 and parameters: {'num_lstm_layers': 2, 'lstm_units_1': 127, 'dropout_1': 0.0758619309675268, 'optimizer': 'Adam', 'lstm_units_2': 79, 'dropout_2': 0.26855407298408335}. Best is trial 10 with value: 0.6150160193443298.
[I 2024-05-07 15:36:25,173] Trial 13 finished with value: 0.5938698053359985 and parameters: {'num_lstm_layers': 2, 'lstm_units_1': 109, 'dropout_1': 0.1325971214244071, 'optimizer': 'Adam', 'lstm_units_2': 127, 'dropout_2': 0.1612444165452368}. Best is trial 10 with value: 0.6150160193443298.
[I 2024-05-07 15:37:24,930] Trial 14 finished with value: 0.5206005811691284 and parameters: {'num_lstm_layers': 3, 'lstm_units_1': 61, 'dropout_1': 0.14242819074949925, 'optimizer': 'SGD', 'lstm_units_2': 64, 'dropout_2': 0.3516592623185578, 'lstm_units_3': 127, 'dropout_3': 0.08170142225035826}. Best is trial 10 with value: 0.6150160193443298.
[I 2024-05-07 15:38:08,186] Trial 15 finished with value: 0.5792950630187989 and parameters: {'num_lstm_layers': 2, 'lstm_units_1': 63, 'dropout_1': 0.0019453525879932765, 'optimizer': 'Adam', 'lstm_units_2': 116, 'dropout_2': 0.48152850946597275}. Best is trial 10 with value: 0.6150160193443298.
[I 2024-05-07 15:39:06,032] Trial 16 finished with value: 0.5937599420547486 and parameters: {'num_lstm_layers': 3, 'lstm_units_1': 111, 'dropout_1': 0.10334901736031801, 'optimizer': 'Adam', 'lstm_units_2': 76, 'dropout_2': 0.3467794785887658, 'lstm_units_3': 93, 'dropout_3': 0.3229041507372415}. Best is trial 10 with value: 0.6150160193443298.
[I 2024-05-07 15:39:33,957] Trial 17 finished with value: 0.5962226510047912 and parameters: {'num_lstm_layers': 1, 'lstm_units_1': 99, 'dropout_1': 0.1667983590911785, 'optimizer': 'Adam'}. Best is trial 10 with value: 0.6150160193443298.
[I 2024-05-07 15:40:16,567] Trial 18 finished with value: 0.5750196695327758 and parameters: {'num_lstm_layers': 2, 'lstm_units_1': 74, 'dropout_1': 0.06217053600034996, 'optimizer': 'SGD', 'lstm_units_2': 97, 'dropout_2': 0.16017149660455532}. Best is trial 10 with value: 0.6150160193443298.
[I 2024-05-07 15:41:13,621] Trial 19 finished with value: 0.5671445608139039 and parameters: {'num_lstm_layers': 3, 'lstm_units_1': 52, 'dropout_1': 0.2869205828473854, 'optimizer': 'Adam', 'lstm_units_2': 17, 'dropout_2': 0.0021228948115528667, 'lstm_units_3': 88, 'dropout_3': 0.007567916203737868}. Best is trial 10 with value: 0.6150160193443298.
[I 2024-05-07 15:41:57,008] Trial 20 finished with value: 0.5980481624603271 and parameters: {'num_lstm_layers': 2, 'lstm_units_1': 117, 'dropout_1': 0.19648809821721858, 'optimizer': 'Adam', 'lstm_units_2': 46, 'dropout_2': 0.4055811491683586}. Best is trial 10 with value: 0.6150160193443298.
[I 2024-05-07 15:42:45,154] Trial 21 finished with value: 0.6071225762367248 and parameters: {'num_lstm_layers': 2, 'lstm_units_1': 119, 'dropout_1': 0.187620217361721, 'optimizer': 'Adam', 'lstm_units_2': 45, 'dropout_2': 0.4216845097910769}. Best is trial 10 with value: 0.6150160193443298.
[I 2024-05-07 15:43:29,164] Trial 22 finished with value: 0.5774201273918151 and parameters: {'num_lstm_layers': 2, 'lstm_units_1': 119, 'dropout_1': 0.2633550364752472, 'optimizer': 'Adam', 'lstm_units_2': 38, 'dropout_2': 0.4858976336605139}. Best is trial 10 with value: 0.6150160193443298.
[I 2024-05-07 15:44:12,165] Trial 23 finished with value: 0.5938643217086792 and parameters: {'num_lstm_layers': 2, 'lstm_units_1': 103, 'dropout_1': 0.09918037902275698, 'optimizer': 'Adam', 'lstm_units_2': 63, 'dropout_2': 0.31893120288769927}. Best is trial 10 with value: 0.6150160193443298.
[I 2024-05-07 15:44:42,273] Trial 24 finished with value: 0.6252934217453003 and parameters: {'num_lstm_layers': 1, 'lstm_units_1': 124, 'dropout_1': 0.18544016382663286, 'optimizer': 'Adam'}. Best is trial 24 with value: 0.6252934217453003.
[I 2024-05-07 15:45:10,140] Trial 25 finished with value: 0.5592712521553039 and parameters: {'num_lstm_layers': 1, 'lstm_units_1': 91, 'dropout_1': 0.1311210928482115, 'optimizer': 'SGD'}. Best is trial 24 with value: 0.6252934217453003.
[I 2024-05-07 15:45:38,891] Trial 26 finished with value: 0.5907845735549927 and parameters: {'num_lstm_layers': 1, 'lstm_units_1': 128, 'dropout_1': 0.048194867800121506, 'optimizer': 'Adam'}. Best is trial 24 with value: 0.6252934217453003.
[I 2024-05-07 15:46:07,219] Trial 27 finished with value: 0.6247056722640991 and parameters: {'num_lstm_layers': 1, 'lstm_units_1': 116, 'dropout_1': 0.2357364323914149, 'optimizer': 'Adam'}. Best is trial 24 with value: 0.6252934217453003.
[I 2024-05-07 15:46:35,373] Trial 28 finished with value: 0.614946448802948 and parameters: {'num_lstm_layers': 1, 'lstm_units_1': 115, 'dropout_1': 0.29519746253104867, 'optimizer': 'Adam'}. Best is trial 24 with value: 0.6252934217453003.
[I 2024-05-07 15:47:03,390] Trial 29 finished with value: 0.5611315608024597 and parameters: {'num_lstm_layers': 1, 'lstm_units_1': 106, 'dropout_1': 0.23034014386241572, 'optimizer': 'SGD'}. Best is trial 24 with value: 0.6252934217453003.
[I 2024-05-07 15:47:31,696] Trial 30 finished with value: 0.5780774593353272 and parameters: {'num_lstm_layers': 1, 'lstm_units_1': 81, 'dropout_1': 0.3105969877577156, 'optimizer': 'Adam'}. Best is trial 24 with value: 0.6252934217453003.
[I 2024-05-07 15:48:00,451] Trial 31 finished with value: 0.6023253679275513 and parameters: {'num_lstm_layers': 1, 'lstm_units_1': 113, 'dropout_1': 0.27272276287845587, 'optimizer': 'Adam'}. Best is trial 24 with value: 0.6252934217453003.
[I 2024-05-07 15:48:30,797] Trial 32 finished with value: 0.6065366625785827 and parameters: {'num_lstm_layers': 1, 'lstm_units_1': 121, 'dropout_1': 0.31701234781033083, 'optimizer': 'Adam'}. Best is trial 24 with value: 0.6252934217453003.
[I 2024-05-07 15:48:58,910] Trial 33 finished with value: 0.605974543094635 and parameters: {'num_lstm_layers': 1, 'lstm_units_1': 122, 'dropout_1': 0.2290673284177505, 'optimizer': 'Adam'}. Best is trial 24 with value: 0.6252934217453003.
[I 2024-05-07 15:49:27,612] Trial 34 finished with value: 0.6235612869262696 and parameters: {'num_lstm_layers': 1, 'lstm_units_1': 113, 'dropout_1': 0.3359261711930535, 'optimizer': 'Adam'}. Best is trial 24 with value: 0.6252934217453003.
[I 2024-05-07 15:50:00,216] Trial 35 finished with value: 0.5205969095230103 and parameters: {'num_lstm_layers': 1, 'lstm_units_1': 16, 'dropout_1': 0.33688712069311294, 'optimizer': 'RMSprop'}. Best is trial 24 with value: 0.6252934217453003.
[I 2024-05-07 15:50:28,809] Trial 36 finished with value: 0.567184853553772 and parameters: {'num_lstm_layers': 1, 'lstm_units_1': 102, 'dropout_1': 0.37516766224814435, 'optimizer': 'Adam'}. Best is trial 24 with value: 0.6252934217453003.
[I 2024-05-07 15:50:57,265] Trial 37 finished with value: 0.633199667930603 and parameters: {'num_lstm_layers': 1, 'lstm_units_1': 108, 'dropout_1': 0.24896640540615844, 'optimizer': 'Adam'}. Best is trial 37 with value: 0.633199667930603.
[I 2024-05-07 15:51:25,608] Trial 38 finished with value: 0.5466300487518311 and parameters: {'num_lstm_layers': 1, 'lstm_units_1': 93, 'dropout_1': 0.24651159982949855, 'optimizer': 'Adam'}. Best is trial 37 with value: 0.633199667930603.
[I 2024-05-07 15:51:55,545] Trial 39 finished with value: 0.5774842143058777 and parameters: {'num_lstm_layers': 1, 'lstm_units_1': 108, 'dropout_1': 0.21426150603591407, 'optimizer': 'RMSprop'}. Best is trial 37 with value: 0.633199667930603.
[I 2024-05-07 15:52:24,189] Trial 40 finished with value: 0.5629534006118775 and parameters: {'num_lstm_layers': 1, 'lstm_units_1': 97, 'dropout_1': 0.3709425914053842, 'optimizer': 'Adam'}. Best is trial 37 with value: 0.633199667930603.
[I 2024-05-07 15:52:53,055] Trial 41 finished with value: 0.6053153872489929 and parameters: {'num_lstm_layers': 1, 'lstm_units_1': 123, 'dropout_1': 0.2537625387195026, 'optimizer': 'Adam'}. Best is trial 37 with value: 0.633199667930603.
[I 2024-05-07 15:53:21,239] Trial 42 finished with value: 0.6235374927520752 and parameters: {'num_lstm_layers': 1, 'lstm_units_1': 112, 'dropout_1': 0.1683600622610829, 'optimizer': 'Adam'}. Best is trial 37 with value: 0.633199667930603.
[I 2024-05-07 15:53:50,023] Trial 43 finished with value: 0.5992968916893006 and parameters: {'num_lstm_layers': 1, 'lstm_units_1': 113, 'dropout_1': 0.16844533870040546, 'optimizer': 'Adam'}. Best is trial 37 with value: 0.633199667930603.
[I 2024-05-07 15:54:17,776] Trial 44 finished with value: 0.5817449569702149 and parameters: {'num_lstm_layers': 1, 'lstm_units_1': 104, 'dropout_1': 0.181456223962912, 'optimizer': 'Adam'}. Best is trial 37 with value: 0.633199667930603.
[I 2024-05-07 15:54:48,323] Trial 45 finished with value: 0.5992291569709778 and parameters: {'num_lstm_layers': 1, 'lstm_units_1': 108, 'dropout_1': 0.19944982953675328, 'optimizer': 'RMSprop'}. Best is trial 37 with value: 0.633199667930603.
[I 2024-05-07 15:55:16,213] Trial 46 finished with value: 0.5993188619613647 and parameters: {'num_lstm_layers': 1, 'lstm_units_1': 48, 'dropout_1': 0.2765119338478603, 'optimizer': 'Adam'}. Best is trial 37 with value: 0.633199667930603.
[I 2024-05-07 15:55:44,158] Trial 47 finished with value: 0.5163398385047913 and parameters: {'num_lstm_layers': 1, 'lstm_units_1': 115, 'dropout_1': 0.21654696500651496, 'optimizer': 'SGD'}. Best is trial 37 with value: 0.633199667930603.
[I 2024-05-07 15:56:14,560] Trial 48 finished with value: 0.6120186805725097 and parameters: {'num_lstm_layers': 1, 'lstm_units_1': 123, 'dropout_1': 0.4383808110662495, 'optimizer': 'Adam'}. Best is trial 37 with value: 0.633199667930603.
[I 2024-05-07 15:56:42,884] Trial 49 finished with value: 0.6633910179138184 and parameters: {'num_lstm_layers': 1, 'lstm_units_1': 87, 'dropout_1': 0.14930587176261081, 'optimizer': 'Adam'}. Best is trial 49 with value: 0.6633910179138184.
[I 2024-05-07 15:57:10,452] Trial 50 finished with value: 0.5689554214477539 and parameters: {'num_lstm_layers': 1, 'lstm_units_1': 84, 'dropout_1': 0.14631285431383517, 'optimizer': 'Adam'}. Best is trial 49 with value: 0.6633910179138184.
[I 2024-05-07 15:57:38,810] Trial 51 finished with value: 0.5605529546737671 and parameters: {'num_lstm_layers': 1, 'lstm_units_1': 100, 'dropout_1': 0.16070823065298703, 'optimizer': 'Adam'}. Best is trial 49 with value: 0.6633910179138184.
[I 2024-05-07 15:58:07,112] Trial 52 finished with value: 0.5919655799865723 and parameters: {'num_lstm_layers': 1, 'lstm_units_1': 76, 'dropout_1': 0.10626752061092033, 'optimizer': 'Adam'}. Best is trial 49 with value: 0.6633910179138184.
[I 2024-05-07 15:58:35,561] Trial 53 finished with value: 0.5744319319725036 and parameters: {'num_lstm_layers': 1, 'lstm_units_1': 91, 'dropout_1': 0.12350834011937034, 'optimizer': 'Adam'}. Best is trial 49 with value: 0.6633910179138184.
[I 2024-05-07 15:59:04,571] Trial 54 finished with value: 0.6052641153335572 and parameters: {'num_lstm_layers': 1, 'lstm_units_1': 111, 'dropout_1': 0.17846939403397194, 'optimizer': 'Adam'}. Best is trial 49 with value: 0.6633910179138184.
[I 2024-05-07 15:59:32,185] Trial 55 finished with value: 0.5810235261917114 and parameters: {'num_lstm_layers': 1, 'lstm_units_1': 67, 'dropout_1': 0.22965770380143882, 'optimizer': 'Adam'}. Best is trial 49 with value: 0.6633910179138184.
[I 2024-05-07 16:00:02,830] Trial 56 finished with value: 0.5569184303283692 and parameters: {'num_lstm_layers': 1, 'lstm_units_1': 95, 'dropout_1': 0.208228325164917, 'optimizer': 'RMSprop'}. Best is trial 49 with value: 0.6633910179138184.
[I 2024-05-07 16:00:31,815] Trial 57 finished with value: 0.6034825682640076 and parameters: {'num_lstm_layers': 1, 'lstm_units_1': 117, 'dropout_1': 0.24992435173537358, 'optimizer': 'Adam'}. Best is trial 49 with value: 0.6633910179138184.
[I 2024-05-07 16:00:59,431] Trial 58 finished with value: 0.5937819361686707 and parameters: {'num_lstm_layers': 1, 'lstm_units_1': 124, 'dropout_1': 0.15071784332471805, 'optimizer': 'SGD'}. Best is trial 49 with value: 0.6633910179138184.
[I 2024-05-07 16:01:27,529] Trial 59 finished with value: 0.5944264531135559 and parameters: {'num_lstm_layers': 1, 'lstm_units_1': 88, 'dropout_1': 0.3015938969323661, 'optimizer': 'Adam'}. Best is trial 49 with value: 0.6633910179138184.
[I 2024-05-07 16:01:55,649] Trial 60 finished with value: 0.5980390191078186 and parameters: {'num_lstm_layers': 1, 'lstm_units_1': 110, 'dropout_1': 0.12280847374498863, 'optimizer': 'Adam'}. Best is trial 49 with value: 0.6633910179138184.
[I 2024-05-07 16:02:39,545] Trial 61 finished with value: 0.625306224822998 and parameters: {'num_lstm_layers': 2, 'lstm_units_1': 128, 'dropout_1': 0.0009912097548220797, 'optimizer': 'Adam', 'lstm_units_2': 111, 'dropout_2': 0.18326202315497875}. Best is trial 49 with value: 0.6633910179138184.
[I 2024-05-07 16:03:41,098] Trial 62 finished with value: 0.6089810490608215 and parameters: {'num_lstm_layers': 3, 'lstm_units_1': 128, 'dropout_1': 0.08174468474796077, 'optimizer': 'Adam', 'lstm_units_2': 110, 'dropout_2': 0.17728825899035608, 'lstm_units_3': 63, 'dropout_3': 0.17817991903627556}. Best is trial 49 with value: 0.6633910179138184.
[I 2024-05-07 16:04:24,608] Trial 63 finished with value: 0.5835319995880127 and parameters: {'num_lstm_layers': 2, 'lstm_units_1': 118, 'dropout_1': 0.007065465435658865, 'optimizer': 'Adam', 'lstm_units_2': 121, 'dropout_2': 0.09791228414199182}. Best is trial 49 with value: 0.6633910179138184.
[I 2024-05-07 16:05:08,293] Trial 64 finished with value: 0.6453080773353577 and parameters: {'num_lstm_layers': 2, 'lstm_units_1': 125, 'dropout_1': 0.3249829028232535, 'optimizer': 'Adam', 'lstm_units_2': 108, 'dropout_2': 0.2071826629540888}. Best is trial 49 with value: 0.6633910179138184.
[I 2024-05-07 16:05:51,830] Trial 65 finished with value: 0.6047788977622985 and parameters: {'num_lstm_layers': 2, 'lstm_units_1': 123, 'dropout_1': 0.3300903671525281, 'optimizer': 'Adam', 'lstm_units_2': 105, 'dropout_2': 0.19969994972157262}. Best is trial 49 with value: 0.6633910179138184.
[I 2024-05-07 16:06:34,576] Trial 66 finished with value: 0.5586560487747192 and parameters: {'num_lstm_layers': 2, 'lstm_units_1': 119, 'dropout_1': 0.3695165307821844, 'optimizer': 'Adam', 'lstm_units_2': 112, 'dropout_2': 0.10819813349669255}. Best is trial 49 with value: 0.6633910179138184.
[I 2024-05-07 16:07:18,471] Trial 67 finished with value: 0.5822612762451171 and parameters: {'num_lstm_layers': 2, 'lstm_units_1': 127, 'dropout_1': 0.42937935652477077, 'optimizer': 'Adam', 'lstm_units_2': 127, 'dropout_2': 0.21109333966719038}. Best is trial 49 with value: 0.6633910179138184.
[I 2024-05-07 16:08:01,607] Trial 68 finished with value: 0.5496035814285278 and parameters: {'num_lstm_layers': 2, 'lstm_units_1': 105, 'dropout_1': 0.3561897920789554, 'optimizer': 'Adam', 'lstm_units_2': 87, 'dropout_2': 0.29406571180733804}. Best is trial 49 with value: 0.6633910179138184.
[I 2024-05-07 16:08:49,813] Trial 69 finished with value: 0.6185718297958374 and parameters: {'num_lstm_layers': 2, 'lstm_units_1': 125, 'dropout_1': 0.3894128519177358, 'optimizer': 'SGD', 'lstm_units_2': 105, 'dropout_2': 0.12960197293216924}. Best is trial 49 with value: 0.6633910179138184.
[I 2024-05-07 16:09:32,962] Trial 70 finished with value: 0.5926155805587768 and parameters: {'num_lstm_layers': 2, 'lstm_units_1': 115, 'dropout_1': 0.28249746998526276, 'optimizer': 'Adam', 'lstm_units_2': 83, 'dropout_2': 0.00730907740117584}. Best is trial 49 with value: 0.6633910179138184.
[I 2024-05-07 16:10:34,754] Trial 71 finished with value: 0.584178352355957 and parameters: {'num_lstm_layers': 3, 'lstm_units_1': 113, 'dropout_1': 0.02731732795715942, 'optimizer': 'Adam', 'lstm_units_2': 66, 'dropout_2': 0.2272768345428166, 'lstm_units_3': 101, 'dropout_3': 0.35788191145467474}. Best is trial 49 with value: 0.6633910179138184.
[I 2024-05-07 16:11:03,969] Trial 72 finished with value: 0.6107717514038086 and parameters: {'num_lstm_layers': 1, 'lstm_units_1': 121, 'dropout_1': 0.24202416856148862, 'optimizer': 'Adam'}. Best is trial 49 with value: 0.6633910179138184.
[I 2024-05-07 16:11:32,830] Trial 73 finished with value: 0.5702425956726074 and parameters: {'num_lstm_layers': 1, 'lstm_units_1': 118, 'dropout_1': 0.32429293580731894, 'optimizer': 'Adam'}. Best is trial 49 with value: 0.6633910179138184.
[I 2024-05-07 16:12:15,721] Trial 74 finished with value: 0.5998974800109863 and parameters: {'num_lstm_layers': 2, 'lstm_units_1': 101, 'dropout_1': 0.2606577904175894, 'optimizer': 'Adam', 'lstm_units_2': 120, 'dropout_2': 0.04046949209126899}. Best is trial 49 with value: 0.6633910179138184.
[I 2024-05-07 16:12:46,604] Trial 75 finished with value: 0.6131831765174866 and parameters: {'num_lstm_layers': 1, 'lstm_units_1': 111, 'dropout_1': 0.34584585484648134, 'optimizer': 'RMSprop'}. Best is trial 49 with value: 0.6633910179138184.
[I 2024-05-07 16:13:15,570] Trial 76 finished with value: 0.5756257534027099 and parameters: {'num_lstm_layers': 1, 'lstm_units_1': 125, 'dropout_1': 0.19034626415421602, 'optimizer': 'Adam'}. Best is trial 49 with value: 0.6633910179138184.
[I 2024-05-07 16:13:43,684] Trial 77 finished with value: 0.5985956430435181 and parameters: {'num_lstm_layers': 1, 'lstm_units_1': 106, 'dropout_1': 0.21965932832102886, 'optimizer': 'Adam'}. Best is trial 49 with value: 0.6633910179138184.
[I 2024-05-07 16:14:26,875] Trial 78 finished with value: 0.5436052322387696 and parameters: {'num_lstm_layers': 2, 'lstm_units_1': 43, 'dropout_1': 0.29942554911755315, 'optimizer': 'Adam', 'lstm_units_2': 95, 'dropout_2': 0.13100250002398772}. Best is trial 49 with value: 0.6633910179138184.
[I 2024-05-07 16:14:57,275] Trial 79 finished with value: 0.5805181741714478 and parameters: {'num_lstm_layers': 1, 'lstm_units_1': 114, 'dropout_1': 0.17291173351287273, 'optimizer': 'Adam'}. Best is trial 49 with value: 0.6633910179138184.
[I 2024-05-07 16:15:25,009] Trial 80 finished with value: 0.6016698718070984 and parameters: {'num_lstm_layers': 1, 'lstm_units_1': 120, 'dropout_1': 0.26474302500893476, 'optimizer': 'Adam'}. Best is trial 49 with value: 0.6633910179138184.
