[I 2024-05-07 17:02:39,071] Trial 166 finished with value: 0.6035100221633911 and parameters: {'num_lstm_layers': 1, 'lstm_units_1': 94, 'dropout_1': 0.2826110826470953, 'optimizer': 'Adam'}. Best is trial 49 with value: 0.6633910179138184.
[I 2024-05-07 17:03:07,841] Trial 167 finished with value: 0.5816954970359802 and parameters: {'num_lstm_layers': 1, 'lstm_units_1': 98, 'dropout_1': 0.1098815954322636, 'optimizer': 'Adam'}. Best is trial 49 with value: 0.6633910179138184.
[I 2024-05-07 17:03:56,398] Trial 168 finished with value: 0.5967902541160583 and parameters: {'num_lstm_layers': 2, 'lstm_units_1': 126, 'dropout_1': 0.09193360844332905, 'optimizer': 'Adam', 'lstm_units_2': 76, 'dropout_2': 0.09150443493243096}. Best is trial 49 with value: 0.6633910179138184.
[I 2024-05-07 17:04:25,132] Trial 169 finished with value: 0.5829277515411377 and parameters: {'num_lstm_layers': 1, 'lstm_units_1': 120, 'dropout_1': 0.4966641242241909, 'optimizer': 'Adam'}. Best is trial 49 with value: 0.6633910179138184.
[I 2024-05-07 17:04:52,789] Trial 170 finished with value: 0.6168506741523743 and parameters: {'num_lstm_layers': 1, 'lstm_units_1': 88, 'dropout_1': 0.46387613379997256, 'optimizer': 'SGD'}. Best is trial 49 with value: 0.6633910179138184.
[I 2024-05-07 17:05:22,482] Trial 171 finished with value: 0.6312551379203797 and parameters: {'num_lstm_layers': 1, 'lstm_units_1': 114, 'dropout_1': 0.25747585870952716, 'optimizer': 'Adam'}. Best is trial 49 with value: 0.6633910179138184.
[I 2024-05-07 17:05:51,403] Trial 172 finished with value: 0.5908175468444824 and parameters: {'num_lstm_layers': 1, 'lstm_units_1': 114, 'dropout_1': 0.25943213333339654, 'optimizer': 'Adam'}. Best is trial 49 with value: 0.6633910179138184.
[I 2024-05-07 17:06:20,337] Trial 173 finished with value: 0.5514931857585907 and parameters: {'num_lstm_layers': 1, 'lstm_units_1': 111, 'dropout_1': 0.27634858854810784, 'optimizer': 'Adam'}. Best is trial 49 with value: 0.6633910179138184.
[I 2024-05-07 17:06:49,281] Trial 174 finished with value: 0.5713924646377564 and parameters: {'num_lstm_layers': 1, 'lstm_units_1': 115, 'dropout_1': 0.26612543678731954, 'optimizer': 'Adam'}. Best is trial 49 with value: 0.6633910179138184.
[I 2024-05-07 17:07:17,549] Trial 175 finished with value: 0.6010161876678467 and parameters: {'num_lstm_layers': 1, 'lstm_units_1': 118, 'dropout_1': 0.24160743703436668, 'optimizer': 'Adam'}. Best is trial 49 with value: 0.6633910179138184.
[I 2024-05-07 17:07:46,224] Trial 176 finished with value: 0.6035393238067627 and parameters: {'num_lstm_layers': 1, 'lstm_units_1': 124, 'dropout_1': 0.3017509925922901, 'optimizer': 'Adam'}. Best is trial 49 with value: 0.6633910179138184.
[I 2024-05-07 17:08:15,010] Trial 177 finished with value: 0.5793133735656738 and parameters: {'num_lstm_layers': 1, 'lstm_units_1': 105, 'dropout_1': 0.225305464125617, 'optimizer': 'Adam'}. Best is trial 49 with value: 0.6633910179138184.
[I 2024-05-07 17:08:57,987] Trial 178 finished with value: 0.6180682897567749 and parameters: {'num_lstm_layers': 2, 'lstm_units_1': 122, 'dropout_1': 0.13753485645209795, 'optimizer': 'Adam', 'lstm_units_2': 68, 'dropout_2': 0.3160569366269558}. Best is trial 49 with value: 0.6633910179138184.
[I 2024-05-07 17:09:26,123] Trial 179 finished with value: 0.5914400815963745 and parameters: {'num_lstm_layers': 1, 'lstm_units_1': 84, 'dropout_1': 0.25648887901953754, 'optimizer': 'Adam'}. Best is trial 49 with value: 0.6633910179138184.
[I 2024-05-07 17:09:55,001] Trial 180 finished with value: 0.6028874754905701 and parameters: {'num_lstm_layers': 1, 'lstm_units_1': 109, 'dropout_1': 0.03170843332958466, 'optimizer': 'Adam'}. Best is trial 49 with value: 0.6633910179138184.
[I 2024-05-07 17:10:25,601] Trial 181 finished with value: 0.5986761927604676 and parameters: {'num_lstm_layers': 1, 'lstm_units_1': 113, 'dropout_1': 0.3126942288524833, 'optimizer': 'Adam'}. Best is trial 49 with value: 0.6633910179138184.
[I 2024-05-07 17:10:54,588] Trial 182 finished with value: 0.5847386240959167 and parameters: {'num_lstm_layers': 1, 'lstm_units_1': 118, 'dropout_1': 0.2496823302235889, 'optimizer': 'Adam'}. Best is trial 49 with value: 0.6633910179138184.
[I 2024-05-07 17:11:22,683] Trial 183 finished with value: 0.619915771484375 and parameters: {'num_lstm_layers': 1, 'lstm_units_1': 115, 'dropout_1': 0.322180627066261, 'optimizer': 'Adam'}. Best is trial 49 with value: 0.6633910179138184.
[I 2024-05-07 17:11:50,800] Trial 184 finished with value: 0.6270694851875305 and parameters: {'num_lstm_layers': 1, 'lstm_units_1': 112, 'dropout_1': 0.48405128783539964, 'optimizer': 'Adam'}. Best is trial 49 with value: 0.6633910179138184.
[I 2024-05-07 17:12:19,583] Trial 185 finished with value: 0.6065696358680726 and parameters: {'num_lstm_layers': 1, 'lstm_units_1': 107, 'dropout_1': 0.4881188687847975, 'optimizer': 'Adam'}. Best is trial 49 with value: 0.6633910179138184.
[I 2024-05-07 17:12:48,296] Trial 186 finished with value: 0.5786450624465942 and parameters: {'num_lstm_layers': 1, 'lstm_units_1': 102, 'dropout_1': 0.453003066182124, 'optimizer': 'Adam'}. Best is trial 49 with value: 0.6633910179138184.
[I 2024-05-07 17:13:31,370] Trial 187 finished with value: 0.6144026279449463 and parameters: {'num_lstm_layers': 2, 'lstm_units_1': 126, 'dropout_1': 0.4784987301229759, 'optimizer': 'Adam', 'lstm_units_2': 124, 'dropout_2': 0.02669717500786701}. Best is trial 49 with value: 0.6633910179138184.
[I 2024-05-07 17:13:59,527] Trial 188 finished with value: 0.568389630317688 and parameters: {'num_lstm_layers': 1, 'lstm_units_1': 110, 'dropout_1': 0.4997925997536575, 'optimizer': 'SGD'}. Best is trial 49 with value: 0.6633910179138184.
[I 2024-05-07 17:14:56,942] Trial 189 finished with value: 0.5338716506958008 and parameters: {'num_lstm_layers': 3, 'lstm_units_1': 128, 'dropout_1': 0.46619688536061116, 'optimizer': 'Adam', 'lstm_units_2': 116, 'dropout_2': 0.21349978843866466, 'lstm_units_3': 20, 'dropout_3': 0.3869509312975881}. Best is trial 49 with value: 0.6633910179138184.
[I 2024-05-07 17:15:25,018] Trial 190 finished with value: 0.6035411596298218 and parameters: {'num_lstm_layers': 1, 'lstm_units_1': 68, 'dropout_1': 0.23457658787024094, 'optimizer': 'Adam'}. Best is trial 49 with value: 0.6633910179138184.
[I 2024-05-07 17:15:52,488] Trial 191 finished with value: 0.5538991093635559 and parameters: {'num_lstm_layers': 1, 'lstm_units_1': 112, 'dropout_1': 0.002540286585976134, 'optimizer': 'Adam'}. Best is trial 49 with value: 0.6633910179138184.
[I 2024-05-07 17:16:20,993] Trial 192 finished with value: 0.6276920199394226 and parameters: {'num_lstm_layers': 1, 'lstm_units_1': 120, 'dropout_1': 0.18729791697347636, 'optimizer': 'Adam'}. Best is trial 49 with value: 0.6633910179138184.
[I 2024-05-07 17:16:49,606] Trial 193 finished with value: 0.5684024572372437 and parameters: {'num_lstm_layers': 1, 'lstm_units_1': 120, 'dropout_1': 0.1862157303184236, 'optimizer': 'Adam'}. Best is trial 49 with value: 0.6633910179138184.
[I 2024-05-07 17:17:18,524] Trial 194 finished with value: 0.6477487802505493 and parameters: {'num_lstm_layers': 1, 'lstm_units_1': 123, 'dropout_1': 0.20117285412836236, 'optimizer': 'Adam'}. Best is trial 49 with value: 0.6633910179138184.
[I 2024-05-07 17:17:47,590] Trial 195 finished with value: 0.6089334487915039 and parameters: {'num_lstm_layers': 1, 'lstm_units_1': 122, 'dropout_1': 0.1991056377865778, 'optimizer': 'Adam'}. Best is trial 49 with value: 0.6633910179138184.
[I 2024-05-07 17:18:15,837] Trial 196 finished with value: 0.6065000295639038 and parameters: {'num_lstm_layers': 1, 'lstm_units_1': 123, 'dropout_1': 0.21164544633325028, 'optimizer': 'Adam'}. Best is trial 49 with value: 0.6633910179138184.
[I 2024-05-07 17:19:03,616] Trial 197 finished with value: 0.6125368475914001 and parameters: {'num_lstm_layers': 2, 'lstm_units_1': 125, 'dropout_1': 0.19195964451183345, 'optimizer': 'RMSprop', 'lstm_units_2': 49, 'dropout_2': 0.25147588936157855}. Best is trial 49 with value: 0.6633910179138184.
[I 2024-05-07 17:19:31,722] Trial 198 finished with value: 0.6465256810188293 and parameters: {'num_lstm_layers': 1, 'lstm_units_1': 117, 'dropout_1': 0.2053014763928911, 'optimizer': 'Adam'}. Best is trial 49 with value: 0.6633910179138184.
[I 2024-05-07 17:20:00,583] Trial 199 finished with value: 0.5756898283958435 and parameters: {'num_lstm_layers': 1, 'lstm_units_1': 117, 'dropout_1': 0.22125207690212254, 'optimizer': 'Adam'}. Best is trial 49 with value: 0.6633910179138184.
Best hyperparameters: {'num_lstm_layers': 1, 'lstm_units_1': 87, 'dropout_1': 0.14930587176261081, 'optimizer': 'Adam'}
