[I 2024-05-07 16:16:07,978] Trial 81 finished with value: 0.6040593147277832 and parameters: {'num_lstm_layers': 2, 'lstm_units_1': 125, 'dropout_1': 0.46084466575548627, 'optimizer': 'SGD', 'lstm_units_2': 106, 'dropout_2': 0.13323877746996374}. Best is trial 49 with value: 0.6633910179138184.
[I 2024-05-07 16:16:50,012] Trial 82 finished with value: 0.5702938795089721 and parameters: {'num_lstm_layers': 2, 'lstm_units_1': 116, 'dropout_1': 0.3496662128364606, 'optimizer': 'SGD', 'lstm_units_2': 106, 'dropout_2': 0.18686432246112067}. Best is trial 49 with value: 0.6633910179138184.
[I 2024-05-07 16:17:34,033] Trial 83 finished with value: 0.5968158960342407 and parameters: {'num_lstm_layers': 2, 'lstm_units_1': 128, 'dropout_1': 0.3884833706329498, 'optimizer': 'Adam', 'lstm_units_2': 101, 'dropout_2': 0.07921361117764503}. Best is trial 49 with value: 0.6633910179138184.
[I 2024-05-07 16:18:16,107] Trial 84 finished with value: 0.5713393807411193 and parameters: {'num_lstm_layers': 2, 'lstm_units_1': 121, 'dropout_1': 0.4989685518698765, 'optimizer': 'SGD', 'lstm_units_2': 120, 'dropout_2': 0.13920136501200642}. Best is trial 49 with value: 0.6633910179138184.
[I 2024-05-07 16:18:57,684] Trial 85 finished with value: 0.6318611979484559 and parameters: {'num_lstm_layers': 2, 'lstm_units_1': 125, 'dropout_1': 0.4137254569675746, 'optimizer': 'SGD', 'lstm_units_2': 72, 'dropout_2': 0.049242181654250664}. Best is trial 49 with value: 0.6633910179138184.
[I 2024-05-07 16:19:54,014] Trial 86 finished with value: 0.5731776893138886 and parameters: {'num_lstm_layers': 3, 'lstm_units_1': 109, 'dropout_1': 0.4585521600062244, 'optimizer': 'SGD', 'lstm_units_2': 56, 'dropout_2': 0.2891915437219524, 'lstm_units_3': 67, 'dropout_3': 0.2043847569214094}. Best is trial 49 with value: 0.6633910179138184.
[I 2024-05-07 16:20:21,932] Trial 87 finished with value: 0.5629112958908081 and parameters: {'num_lstm_layers': 1, 'lstm_units_1': 121, 'dropout_1': 0.4144603412904836, 'optimizer': 'SGD'}. Best is trial 49 with value: 0.6633910179138184.
[I 2024-05-07 16:21:09,083] Trial 88 finished with value: 0.5799322485923767 and parameters: {'num_lstm_layers': 2, 'lstm_units_1': 125, 'dropout_1': 0.1997899004369011, 'optimizer': 'RMSprop', 'lstm_units_2': 71, 'dropout_2': 0.05337584527026312}. Best is trial 49 with value: 0.6633910179138184.
[I 2024-05-07 16:21:37,490] Trial 89 finished with value: 0.5907534599304199 and parameters: {'num_lstm_layers': 1, 'lstm_units_1': 56, 'dropout_1': 0.08232571055515943, 'optimizer': 'Adam'}. Best is trial 49 with value: 0.6633910179138184.
[I 2024-05-07 16:22:05,456] Trial 90 finished with value: 0.5847477793693543 and parameters: {'num_lstm_layers': 1, 'lstm_units_1': 80, 'dropout_1': 0.22978887387026226, 'optimizer': 'Adam'}. Best is trial 49 with value: 0.6633910179138184.
[I 2024-05-07 16:22:47,419] Trial 91 finished with value: 0.5811407089233398 and parameters: {'num_lstm_layers': 2, 'lstm_units_1': 125, 'dropout_1': 0.3786302338949154, 'optimizer': 'SGD', 'lstm_units_2': 90, 'dropout_2': 0.031993196658199954}. Best is trial 49 with value: 0.6633910179138184.
[I 2024-05-07 16:23:30,421] Trial 92 finished with value: 0.5339082717895508 and parameters: {'num_lstm_layers': 2, 'lstm_units_1': 118, 'dropout_1': 0.4056233908818137, 'optimizer': 'SGD', 'lstm_units_2': 81, 'dropout_2': 0.10406594361012991}. Best is trial 49 with value: 0.6633910179138184.
[I 2024-05-07 16:24:12,696] Trial 93 finished with value: 0.5581452012062073 and parameters: {'num_lstm_layers': 2, 'lstm_units_1': 113, 'dropout_1': 0.39835627104929067, 'optimizer': 'SGD', 'lstm_units_2': 114, 'dropout_2': 0.07372573484848094}. Best is trial 49 with value: 0.6633910179138184.
[I 2024-05-07 16:24:54,223] Trial 94 finished with value: 0.5768598318099976 and parameters: {'num_lstm_layers': 2, 'lstm_units_1': 128, 'dropout_1': 0.43282053731016246, 'optimizer': 'SGD', 'lstm_units_2': 71, 'dropout_2': 0.242622529701298}. Best is trial 49 with value: 0.6633910179138184.
[I 2024-05-07 16:25:36,896] Trial 95 finished with value: 0.5642314314842224 and parameters: {'num_lstm_layers': 2, 'lstm_units_1': 123, 'dropout_1': 0.362776054740269, 'optimizer': 'SGD', 'lstm_units_2': 101, 'dropout_2': 0.15930773371369553}. Best is trial 49 with value: 0.6633910179138184.
[I 2024-05-07 16:26:19,923] Trial 96 finished with value: 0.5877671003341675 and parameters: {'num_lstm_layers': 2, 'lstm_units_1': 117, 'dropout_1': 0.31116933101872796, 'optimizer': 'Adam', 'lstm_units_2': 86, 'dropout_2': 0.21319068495646804}. Best is trial 49 with value: 0.6633910179138184.
[I 2024-05-07 16:26:48,464] Trial 97 finished with value: 0.56053466796875 and parameters: {'num_lstm_layers': 1, 'lstm_units_1': 97, 'dropout_1': 0.1418312214465121, 'optimizer': 'Adam'}. Best is trial 49 with value: 0.6633910179138184.
[I 2024-05-07 16:27:16,075] Trial 98 finished with value: 0.585857355594635 and parameters: {'num_lstm_layers': 1, 'lstm_units_1': 108, 'dropout_1': 0.3828578586368331, 'optimizer': 'SGD'}. Best is trial 49 with value: 0.6633910179138184.
[I 2024-05-07 16:27:59,445] Trial 99 finished with value: 0.5974475979804993 and parameters: {'num_lstm_layers': 2, 'lstm_units_1': 126, 'dropout_1': 0.15893005646190456, 'optimizer': 'Adam', 'lstm_units_2': 95, 'dropout_2': 0.12161306605561535}. Best is trial 49 with value: 0.6633910179138184.
[I 2024-05-07 16:28:28,396] Trial 100 finished with value: 0.6247001767158509 and parameters: {'num_lstm_layers': 1, 'lstm_units_1': 121, 'dropout_1': 0.44993504351965674, 'optimizer': 'Adam'}. Best is trial 49 with value: 0.6633910179138184.
[I 2024-05-07 16:28:56,891] Trial 101 finished with value: 0.6246562361717224 and parameters: {'num_lstm_layers': 1, 'lstm_units_1': 120, 'dropout_1': 0.48550899437898287, 'optimizer': 'Adam'}. Best is trial 49 with value: 0.6633910179138184.
[I 2024-05-07 16:29:25,698] Trial 102 finished with value: 0.5641545176506042 and parameters: {'num_lstm_layers': 1, 'lstm_units_1': 121, 'dropout_1': 0.4831896126339904, 'optimizer': 'Adam'}. Best is trial 49 with value: 0.6633910179138184.
[I 2024-05-07 16:29:53,408] Trial 103 finished with value: 0.5732527613639832 and parameters: {'num_lstm_layers': 1, 'lstm_units_1': 116, 'dropout_1': 0.458322514047969, 'optimizer': 'Adam'}. Best is trial 49 with value: 0.6633910179138184.
[I 2024-05-07 16:30:21,927] Trial 104 finished with value: 0.5393335223197937 and parameters: {'num_lstm_layers': 1, 'lstm_units_1': 71, 'dropout_1': 0.4814661161380951, 'optimizer': 'Adam'}. Best is trial 49 with value: 0.6633910179138184.
[I 2024-05-07 16:30:50,808] Trial 105 finished with value: 0.5823528409004212 and parameters: {'num_lstm_layers': 1, 'lstm_units_1': 111, 'dropout_1': 0.44234699947748785, 'optimizer': 'Adam'}. Best is trial 49 with value: 0.6633910179138184.
[I 2024-05-07 16:31:19,539] Trial 106 finished with value: 0.5774439334869385 and parameters: {'num_lstm_layers': 1, 'lstm_units_1': 119, 'dropout_1': 0.4448269808817541, 'optimizer': 'Adam'}. Best is trial 49 with value: 0.6633910179138184.
[I 2024-05-07 16:31:48,270] Trial 107 finished with value: 0.5701748609542847 and parameters: {'num_lstm_layers': 1, 'lstm_units_1': 103, 'dropout_1': 0.46690018420963514, 'optimizer': 'Adam'}. Best is trial 49 with value: 0.6633910179138184.
[I 2024-05-07 16:32:16,670] Trial 108 finished with value: 0.6119838833808899 and parameters: {'num_lstm_layers': 1, 'lstm_units_1': 123, 'dropout_1': 0.4227233822852783, 'optimizer': 'Adam'}. Best is trial 49 with value: 0.6633910179138184.
[I 2024-05-07 16:32:45,384] Trial 109 finished with value: 0.6089700698852539 and parameters: {'num_lstm_layers': 1, 'lstm_units_1': 113, 'dropout_1': 0.48706131825613636, 'optimizer': 'Adam'}. Best is trial 49 with value: 0.6633910179138184.
[I 2024-05-07 16:33:14,143] Trial 110 finished with value: 0.5751093983650207 and parameters: {'num_lstm_layers': 1, 'lstm_units_1': 115, 'dropout_1': 0.1876096203401384, 'optimizer': 'Adam'}. Best is trial 49 with value: 0.6633910179138184.
[I 2024-05-07 16:33:42,926] Trial 111 finished with value: 0.6173523783683776 and parameters: {'num_lstm_layers': 1, 'lstm_units_1': 123, 'dropout_1': 0.40760215306342634, 'optimizer': 'Adam'}. Best is trial 49 with value: 0.6633910179138184.
[I 2024-05-07 16:34:11,588] Trial 112 finished with value: 0.613210654258728 and parameters: {'num_lstm_layers': 1, 'lstm_units_1': 120, 'dropout_1': 0.44885822180351453, 'optimizer': 'Adam'}. Best is trial 49 with value: 0.6633910179138184.
[I 2024-05-07 16:34:41,789] Trial 113 finished with value: 0.5944337606430053 and parameters: {'num_lstm_layers': 1, 'lstm_units_1': 126, 'dropout_1': 0.2933449628164735, 'optimizer': 'RMSprop'}. Best is trial 49 with value: 0.6633910179138184.
[I 2024-05-07 16:35:25,693] Trial 114 finished with value: 0.631883180141449 and parameters: {'num_lstm_layers': 2, 'lstm_units_1': 128, 'dropout_1': 0.47327278282787505, 'optimizer': 'Adam', 'lstm_units_2': 56, 'dropout_2': 0.17472273738526375}. Best is trial 49 with value: 0.6633910179138184.
[I 2024-05-07 16:35:54,603] Trial 115 finished with value: 0.6107369899749756 and parameters: {'num_lstm_layers': 1, 'lstm_units_1': 127, 'dropout_1': 0.47434715856471327, 'optimizer': 'Adam'}. Best is trial 49 with value: 0.6633910179138184.
[I 2024-05-07 16:36:37,898] Trial 116 finished with value: 0.5792566180229187 and parameters: {'num_lstm_layers': 2, 'lstm_units_1': 118, 'dropout_1': 0.4914861657585087, 'optimizer': 'Adam', 'lstm_units_2': 54, 'dropout_2': 0.26031083236811187}. Best is trial 49 with value: 0.6633910179138184.
[I 2024-05-07 16:37:06,797] Trial 117 finished with value: 0.561713820695877 and parameters: {'num_lstm_layers': 1, 'lstm_units_1': 123, 'dropout_1': 0.27206589644906515, 'optimizer': 'Adam'}. Best is trial 49 with value: 0.6633910179138184.
[I 2024-05-07 16:37:35,626] Trial 118 finished with value: 0.5943641781806945 and parameters: {'num_lstm_layers': 1, 'lstm_units_1': 121, 'dropout_1': 0.23781861721112915, 'optimizer': 'Adam'}. Best is trial 49 with value: 0.6633910179138184.
[I 2024-05-07 16:38:03,865] Trial 119 finished with value: 0.627042019367218 and parameters: {'num_lstm_layers': 1, 'lstm_units_1': 106, 'dropout_1': 0.11409019507722246, 'optimizer': 'Adam'}. Best is trial 49 with value: 0.6633910179138184.
[I 2024-05-07 16:38:32,719] Trial 120 finished with value: 0.5702279567718506 and parameters: {'num_lstm_layers': 1, 'lstm_units_1': 106, 'dropout_1': 0.13151552783759032, 'optimizer': 'Adam'}. Best is trial 49 with value: 0.6633910179138184.
[I 2024-05-07 16:39:01,634] Trial 121 finished with value: 0.5883640050888062 and parameters: {'num_lstm_layers': 1, 'lstm_units_1': 110, 'dropout_1': 0.11665488702339565, 'optimizer': 'Adam'}. Best is trial 49 with value: 0.6633910179138184.
[I 2024-05-07 16:39:30,379] Trial 122 finished with value: 0.6168030977249146 and parameters: {'num_lstm_layers': 1, 'lstm_units_1': 128, 'dropout_1': 0.049645722738191636, 'optimizer': 'Adam'}. Best is trial 49 with value: 0.6633910179138184.
[I 2024-05-07 16:39:57,807] Trial 123 finished with value: 0.5877341389656067 and parameters: {'num_lstm_layers': 1, 'lstm_units_1': 112, 'dropout_1': 0.21684105145233318, 'optimizer': 'Adam'}. Best is trial 49 with value: 0.6633910179138184.
[I 2024-05-07 16:40:27,975] Trial 124 finished with value: 0.5720333099365235 and parameters: {'num_lstm_layers': 1, 'lstm_units_1': 116, 'dropout_1': 0.17117050456496535, 'optimizer': 'Adam'}. Best is trial 49 with value: 0.6633910179138184.
[I 2024-05-07 16:41:11,631] Trial 125 finished with value: 0.6161860346794128 and parameters: {'num_lstm_layers': 2, 'lstm_units_1': 107, 'dropout_1': 0.1462275810635561, 'optimizer': 'Adam', 'lstm_units_2': 35, 'dropout_2': 0.19295372021432017}. Best is trial 49 with value: 0.6633910179138184.
[I 2024-05-07 16:41:39,590] Trial 126 finished with value: 0.634404456615448 and parameters: {'num_lstm_layers': 1, 'lstm_units_1': 98, 'dropout_1': 0.011180262959599558, 'optimizer': 'Adam'}. Best is trial 49 with value: 0.6633910179138184.
[I 2024-05-07 16:42:08,125] Trial 127 finished with value: 0.571441912651062 and parameters: {'num_lstm_layers': 1, 'lstm_units_1': 91, 'dropout_1': 0.020909683221809805, 'optimizer': 'Adam'}. Best is trial 49 with value: 0.6633910179138184.
[I 2024-05-07 16:42:36,950] Trial 128 finished with value: 0.5829698860645294 and parameters: {'num_lstm_layers': 1, 'lstm_units_1': 101, 'dropout_1': 0.045452047586420866, 'optimizer': 'Adam'}. Best is trial 49 with value: 0.6633910179138184.
[I 2024-05-07 16:43:18,454] Trial 129 finished with value: 0.5998846530914307 and parameters: {'num_lstm_layers': 2, 'lstm_units_1': 96, 'dropout_1': 0.0010408695012676145, 'optimizer': 'Adam', 'lstm_units_2': 60, 'dropout_2': 0.3777777331935439}. Best is trial 49 with value: 0.6633910179138184.
[I 2024-05-07 16:43:46,909] Trial 130 finished with value: 0.5901986598968506 and parameters: {'num_lstm_layers': 1, 'lstm_units_1': 104, 'dropout_1': 0.011541626419591767, 'optimizer': 'Adam'}. Best is trial 49 with value: 0.6633910179138184.
[I 2024-05-07 16:44:15,915] Trial 131 finished with value: 0.5931886792182922 and parameters: {'num_lstm_layers': 1, 'lstm_units_1': 109, 'dropout_1': 0.10001919499266007, 'optimizer': 'Adam'}. Best is trial 49 with value: 0.6633910179138184.
[I 2024-05-07 16:44:44,535] Trial 132 finished with value: 0.5913778305053711 and parameters: {'num_lstm_layers': 1, 'lstm_units_1': 99, 'dropout_1': 0.4709891449025532, 'optimizer': 'Adam'}. Best is trial 49 with value: 0.6633910179138184.
[I 2024-05-07 16:45:12,769] Trial 133 finished with value: 0.5841600298881531 and parameters: {'num_lstm_layers': 1, 'lstm_units_1': 119, 'dropout_1': 0.014149846989351279, 'optimizer': 'Adam'}. Best is trial 49 with value: 0.6633910179138184.
[I 2024-05-07 16:45:41,687] Trial 134 finished with value: 0.582971704006195 and parameters: {'num_lstm_layers': 1, 'lstm_units_1': 125, 'dropout_1': 0.03380448571589876, 'optimizer': 'Adam'}. Best is trial 49 with value: 0.6633910179138184.
[I 2024-05-07 16:46:10,404] Trial 135 finished with value: 0.5998864769935608 and parameters: {'num_lstm_layers': 1, 'lstm_units_1': 114, 'dropout_1': 0.06424479239393655, 'optimizer': 'Adam'}. Best is trial 49 with value: 0.6633910179138184.
[I 2024-05-07 16:47:07,519] Trial 136 finished with value: 0.5502041578292847 and parameters: {'num_lstm_layers': 3, 'lstm_units_1': 86, 'dropout_1': 0.16078357363601592, 'optimizer': 'Adam', 'lstm_units_2': 27, 'dropout_2': 0.2810636146867287, 'lstm_units_3': 48, 'dropout_3': 0.091359947706529}. Best is trial 49 with value: 0.6633910179138184.
[I 2024-05-07 16:47:54,910] Trial 137 finished with value: 0.5769074320793152 and parameters: {'num_lstm_layers': 2, 'lstm_units_1': 82, 'dropout_1': 0.20887412829332222, 'optimizer': 'RMSprop', 'lstm_units_2': 75, 'dropout_2': 0.31358604357619724}. Best is trial 49 with value: 0.6633910179138184.
[I 2024-05-07 16:48:25,243] Trial 138 finished with value: 0.6247514486312866 and parameters: {'num_lstm_layers': 1, 'lstm_units_1': 123, 'dropout_1': 0.258976306390587, 'optimizer': 'Adam'}. Best is trial 49 with value: 0.6633910179138184.
[I 2024-05-07 16:48:54,117] Trial 139 finished with value: 0.6222448110580444 and parameters: {'num_lstm_layers': 1, 'lstm_units_1': 122, 'dropout_1': 0.45463507273983966, 'optimizer': 'Adam'}. Best is trial 49 with value: 0.6633910179138184.
[I 2024-05-07 16:49:22,783] Trial 140 finished with value: 0.5919564247131348 and parameters: {'num_lstm_layers': 1, 'lstm_units_1': 93, 'dropout_1': 0.25592470280127, 'optimizer': 'Adam'}. Best is trial 49 with value: 0.6633910179138184.
[I 2024-05-07 16:49:51,526] Trial 141 finished with value: 0.6015856504440308 and parameters: {'num_lstm_layers': 1, 'lstm_units_1': 124, 'dropout_1': 0.17837480667360817, 'optimizer': 'Adam'}. Best is trial 49 with value: 0.6633910179138184.
[I 2024-05-07 16:50:19,518] Trial 142 finished with value: 0.6373560547828674 and parameters: {'num_lstm_layers': 1, 'lstm_units_1': 128, 'dropout_1': 0.24329728268841605, 'optimizer': 'Adam'}. Best is trial 49 with value: 0.6633910179138184.
[I 2024-05-07 16:50:48,290] Trial 143 finished with value: 0.5962336301803589 and parameters: {'num_lstm_layers': 1, 'lstm_units_1': 128, 'dropout_1': 0.23992674389261834, 'optimizer': 'Adam'}. Best is trial 49 with value: 0.6633910179138184.
[I 2024-05-07 16:51:17,258] Trial 144 finished with value: 0.6221770524978638 and parameters: {'num_lstm_layers': 1, 'lstm_units_1': 126, 'dropout_1': 0.2667107475171546, 'optimizer': 'Adam'}. Best is trial 49 with value: 0.6633910179138184.
[I 2024-05-07 16:52:00,072] Trial 145 finished with value: 0.604149055480957 and parameters: {'num_lstm_layers': 2, 'lstm_units_1': 120, 'dropout_1': 0.278457023136276, 'optimizer': 'Adam', 'lstm_units_2': 47, 'dropout_2': 0.16767578779963857}. Best is trial 49 with value: 0.6633910179138184.
[I 2024-05-07 16:52:28,738] Trial 146 finished with value: 0.6077378034591675 and parameters: {'num_lstm_layers': 1, 'lstm_units_1': 124, 'dropout_1': 0.33421834277556023, 'optimizer': 'Adam'}. Best is trial 49 with value: 0.6633910179138184.
[I 2024-05-07 16:52:57,548] Trial 147 finished with value: 0.6361439228057861 and parameters: {'num_lstm_layers': 1, 'lstm_units_1': 117, 'dropout_1': 0.24687313428050742, 'optimizer': 'Adam'}. Best is trial 49 with value: 0.6633910179138184.
[I 2024-05-07 16:53:26,332] Trial 148 finished with value: 0.6295926094055175 and parameters: {'num_lstm_layers': 1, 'lstm_units_1': 117, 'dropout_1': 0.22505722005935963, 'optimizer': 'Adam'}. Best is trial 49 with value: 0.6633910179138184.
[I 2024-05-07 16:54:09,541] Trial 149 finished with value: 0.604110586643219 and parameters: {'num_lstm_layers': 2, 'lstm_units_1': 122, 'dropout_1': 0.225975429640885, 'optimizer': 'Adam', 'lstm_units_2': 60, 'dropout_2': 0.15008409814935098}. Best is trial 49 with value: 0.6633910179138184.
[I 2024-05-07 16:54:38,533] Trial 150 finished with value: 0.5865677833557129 and parameters: {'num_lstm_layers': 1, 'lstm_units_1': 126, 'dropout_1': 0.24977806412468914, 'optimizer': 'Adam'}. Best is trial 49 with value: 0.6633910179138184.
[I 2024-05-07 16:55:07,057] Trial 151 finished with value: 0.6096274018287658 and parameters: {'num_lstm_layers': 1, 'lstm_units_1': 116, 'dropout_1': 0.23510804424022896, 'optimizer': 'Adam'}. Best is trial 49 with value: 0.6633910179138184.
[I 2024-05-07 16:55:35,159] Trial 152 finished with value: 0.6180152058601379 and parameters: {'num_lstm_layers': 1, 'lstm_units_1': 128, 'dropout_1': 0.24663445007763662, 'optimizer': 'Adam'}. Best is trial 49 with value: 0.6633910179138184.
[I 2024-05-07 16:56:04,087] Trial 153 finished with value: 0.5896054267883301 and parameters: {'num_lstm_layers': 1, 'lstm_units_1': 119, 'dropout_1': 0.22284679241219685, 'optimizer': 'Adam'}. Best is trial 49 with value: 0.6633910179138184.
[I 2024-05-07 16:56:32,865] Trial 154 finished with value: 0.6131886839866638 and parameters: {'num_lstm_layers': 1, 'lstm_units_1': 122, 'dropout_1': 0.20687283719272137, 'optimizer': 'Adam'}. Best is trial 49 with value: 0.6633910179138184.
[I 2024-05-07 16:57:03,186] Trial 155 finished with value: 0.6047441244125367 and parameters: {'num_lstm_layers': 1, 'lstm_units_1': 117, 'dropout_1': 0.1944974572542273, 'optimizer': 'Adam'}. Best is trial 49 with value: 0.6633910179138184.
[I 2024-05-07 16:57:32,733] Trial 156 finished with value: 0.5496347069740295 and parameters: {'num_lstm_layers': 1, 'lstm_units_1': 124, 'dropout_1': 0.47652891110225803, 'optimizer': 'Adam'}. Best is trial 49 with value: 0.6633910179138184.
[I 2024-05-07 16:58:02,731] Trial 157 finished with value: 0.6494992136955261 and parameters: {'num_lstm_layers': 1, 'lstm_units_1': 89, 'dropout_1': 0.2599525753458897, 'optimizer': 'Adam'}. Best is trial 49 with value: 0.6633910179138184.
[I 2024-05-07 16:58:46,265] Trial 158 finished with value: 0.616828715801239 and parameters: {'num_lstm_layers': 2, 'lstm_units_1': 128, 'dropout_1': 0.25226903086155916, 'optimizer': 'Adam', 'lstm_units_2': 40, 'dropout_2': 0.2323979518773483}. Best is trial 49 with value: 0.6633910179138184.
[I 2024-05-07 16:59:15,683] Trial 159 finished with value: 0.6035594582557678 and parameters: {'num_lstm_layers': 1, 'lstm_units_1': 89, 'dropout_1': 0.28960233530396984, 'optimizer': 'Adam'}. Best is trial 49 with value: 0.6633910179138184.
[I 2024-05-07 16:59:47,530] Trial 160 finished with value: 0.521805363893509 and parameters: {'num_lstm_layers': 1, 'lstm_units_1': 23, 'dropout_1': 0.25901574122339494, 'optimizer': 'RMSprop'}. Best is trial 49 with value: 0.6633910179138184.
[I 2024-05-07 17:00:16,319] Trial 161 finished with value: 0.5962299704551697 and parameters: {'num_lstm_layers': 1, 'lstm_units_1': 120, 'dropout_1': 0.26966520797947635, 'optimizer': 'Adam'}. Best is trial 49 with value: 0.6633910179138184.
[I 2024-05-07 17:00:45,172] Trial 162 finished with value: 0.6137892603874207 and parameters: {'num_lstm_layers': 1, 'lstm_units_1': 125, 'dropout_1': 0.23829933045005447, 'optimizer': 'Adam'}. Best is trial 49 with value: 0.6633910179138184.
[I 2024-05-07 17:01:14,050] Trial 163 finished with value: 0.6222631216049195 and parameters: {'num_lstm_layers': 1, 'lstm_units_1': 122, 'dropout_1': 0.23043457449155186, 'optimizer': 'Adam'}. Best is trial 49 with value: 0.6633910179138184.
[I 2024-05-07 17:01:41,824] Trial 164 finished with value: 0.5423565089702607 and parameters: {'num_lstm_layers': 1, 'lstm_units_1': 77, 'dropout_1': 0.24527624854462166, 'optimizer': 'Adam'}. Best is trial 49 with value: 0.6633910179138184.
[I 2024-05-07 17:02:10,631] Trial 165 finished with value: 0.587192153930664 and parameters: {'num_lstm_layers': 1, 'lstm_units_1': 117, 'dropout_1': 0.21529861873197198, 'optimizer': 'Adam'}. Best is trial 49 with value: 0.6633910179138184.
